[
  {
    "image_id": 1,
    "bbox": [
      272.0,
      236.0,
      28.0,
      25.0
    ],
    "score": 0.5399537086486816,
    "category_id": 3
  },
  {
    "image_id": 1,
    "bbox": [
      202.0,
      303.0,
      54.0,
      44.0
    ],
    "score": 0.5898345112800598,
    "category_id": 3
  },
  {
    "image_id": 1,
    "bbox": [
      311.0,
      234.0,
      26.0,
      28.0
    ],
    "score": 0.6334102749824524,
    "category_id": 3
  },
  {
    "image_id": 1,
    "bbox": [
      346.0,
      296.0,
      46.0,
      52.0
    ],
    "score": 0.6566582918167114,
    "category_id": 3
  },
  {
    "image_id": 1,
    "bbox": [
      398.0,
      310.0,
      41.0,
      50.0
    ],
    "score": 0.754191517829895,
    "category_id": 3
  },
  {
    "image_id": 1,
    "bbox": [
      269.0,
      274.0,
      46.0,
      45.0
    ],
    "score": 0.7994422912597656,
    "category_id": 3
  }
]